{
    "virtualReferenceCollectionMetaData": {
        "referenceCollectionID": "string",
        "creator": "string",
        "maintainer": "string",
        "copyrightLicense": "string",
        "copyrightOwner": "string",
        "title": "string",
        "description": "string",
        "area": [
            "string"
        ],
        "includedTaxaDescription": "string",
        "taxaIncluded": [
            "string"
        ],
        "language": "string",
        "lastUpdate": "string"
    },
    "media": {
        "mediaID": "string",
        "documentOccurrenceID": "string",
        "copyrightLicense": "string",
        "mediaDataURL": "string",
        "reviewed": true
    },
    "organism": {
        "organismID": "string"
    },
    "occurrence": {
        "occurrenceID": "string"
    },
    "taxon": {
        "taxonID": "string",
        "taxonValidNameID": "string"
    },
    "taxonName": {
        "taxonNameID": "string",
        "taxonFullName": "string",
        "taxonNameAuthor": "string",
        "taxonNameYear": 1950,
        "taxonNameBrackets": "string"
    }
}